{
  "apiVersion": "gcac.compatibility/v1", "profileId": "linux-sysv-apache", "version": "1.0", "status": "experimental",
  "match": {
    "id": "linux-sysv-apache.match", "ownerType": "provider_action", "ownerId": "linux-sysv-apache",
    "requiredAll": [
      { "capabilityKey": "agent.full.online", "operator": "equals", "expected": true, "reason": "需要 Linux Full Agent 在线", "riskIfMissing": "无法执行本机部署" },
      { "capabilityKey": "linux.sysv.v1", "operator": "equals", "expected": true, "reason": "需要唯一有效的 SysV 服务控制能力", "riskIfMissing": "无法安全重载服务" },
      { "capabilityKey": "linux.filesystem.posix-atomic.v1", "operator": "equals", "expected": true, "reason": "需要 POSIX 原子文件替换", "riskIfMissing": "证书替换可能留下不完整文件" },
      { "capabilityKey": "apache.cert.install", "operator": "equals", "expected": true, "reason": "需要 Apache 证书安装能力", "riskIfMissing": "无法完成证书部署" }
    ], "optional": [], "anyOfGroups": [], "forbidden": [], "minConfidence": 80, "allowManual": false, "riskLevel": "critical"
  },
  "composition": { "product": "product.apache", "certificate_store": "certificate-store.posix-filesystem", "artifact_codec": "artifact-codec.pem", "service_controller": "service-controller.sysv", "transport": "transport.agent-local", "verifier": "verifier.tls-remote", "rollback": "rollback.posix-certificate-files" },
  "automation": "full", "rollbackRequired": true, "verificationRequired": true,
  "limitations": ["仅有 SysV+sudo fixture 和合同测试，缺少真实 SysV 服务认证", "当前证据不代表 Enterprise Linux 全版本支持"],
  "evidence": [
    { "evidenceId": "linux.sysv.sudo.fixture", "type": "fixture", "status": "passed", "reference": "compatibility/fixtures/linux/sysv-sudo-amd64.json", "observedAt": "2026-07-21T00:00:00.000Z", "expiresAt": "2026-10-21T00:00:00.000Z" },
    { "evidenceId": "linux.apache.local-contract", "type": "contract_test", "status": "passed", "reference": "agents/linux-go-full-agent/internal/handlers/productruntime/runtime_test.go", "observedAt": "2026-07-21T00:00:00.000Z", "expiresAt": "2026-10-21T00:00:00.000Z" }
  ], "publishedAt": "2026-07-21T00:00:00.000Z"
}
