{
  "apiVersion": "gcac.compatibility/v1",
  "profileId": "linux-systemd-nginx",
  "version": "1.0",
  "status": "experimental",
  "match": {
    "id": "linux-systemd-nginx.match", "ownerType": "provider_action", "ownerId": "linux-systemd-nginx",
    "requiredAll": [
      { "capabilityKey": "agent.full.online", "operator": "equals", "expected": true, "reason": "需要 Linux Full Agent 在线", "riskIfMissing": "无法执行本机部署" },
      { "capabilityKey": "linux.systemd.v1", "operator": "equals", "expected": true, "reason": "需要唯一有效的 systemd 服务控制能力", "riskIfMissing": "无法安全重载服务" },
      { "capabilityKey": "linux.filesystem.posix-atomic.v1", "operator": "equals", "expected": true, "reason": "需要 POSIX 原子文件替换", "riskIfMissing": "证书替换可能留下不完整文件" },
      { "capabilityKey": "nginx.cert.install", "operator": "equals", "expected": true, "reason": "需要 Nginx 证书安装能力", "riskIfMissing": "无法完成证书部署" }
    ],
    "optional": [], "anyOfGroups": [], "forbidden": [], "minConfidence": 80, "allowManual": false, "riskLevel": "critical"
  },
  "composition": {
    "product": "product.nginx", "certificate_store": "certificate-store.posix-filesystem", "artifact_codec": "artifact-codec.pem",
    "service_controller": "service-controller.systemd", "transport": "transport.agent-local", "verifier": "verifier.tls-remote", "rollback": "rollback.posix-certificate-files"
  },
  "automation": "full", "rollbackRequired": true, "verificationRequired": true,
  "limitations": ["仅由合同测试、fixture 和本地失败注入验证，真实 Linux VM 认证完成前不得提升为 certified", "发行版名称只描述认证环境，不参与运行时分派"],
  "evidence": [
    { "evidenceId": "linux.nginx.agent-regression", "type": "contract_test", "status": "passed", "reference": "agents/linux-go-full-agent/main_test.go", "observedAt": "2026-07-21T00:00:00.000Z", "expiresAt": "2026-10-21T00:00:00.000Z" },
    { "evidenceId": "linux.systemd.apparmor.fixture", "type": "fixture", "status": "passed", "reference": "compatibility/fixtures/linux/systemd-apparmor-amd64.json", "observedAt": "2026-07-21T00:00:00.000Z", "expiresAt": "2026-10-21T00:00:00.000Z" }
  ],
  "publishedAt": "2026-07-21T00:00:00.000Z"
}
