{
  "apiVersion": "gcac.compatibility/v1",
  "profileId": "windows-compatibility-iis",
  "version": "1.0",
  "status": "experimental",
  "match": {
    "id": "windows-compatibility-iis.match",
    "ownerType": "provider_action",
    "ownerId": "windows-compatibility-iis",
    "requiredAll": [
      { "capabilityKey": "agent.full.online", "operator": "equals", "expected": true, "reason": "需要 Full Agent 在线", "riskIfMissing": "无法执行自动部署" },
      { "capabilityKey": "runtime.windows.compatibility_agent", "operator": "equals", "expected": true, "reason": "需要兼容版 Windows Runtime 能力", "riskIfMissing": "不能使用旧版 Windows 受控执行能力" },
      { "capabilityKey": "iis.binding.update", "operator": "equals", "expected": true, "reason": "需要更新 IIS HTTPS Binding", "riskIfMissing": "无法完成 IIS 证书替换" }
    ],
    "optional": [],
    "anyOfGroups": [],
    "forbidden": [],
    "minConfidence": 80,
    "allowManual": false,
    "riskLevel": "critical"
  },
  "composition": {
    "product": "product.iis-apphost",
    "certificate_store": "certificate-store.windows",
    "artifact_codec": "artifact-codec.pkcs12",
    "service_controller": "service-controller.windows-scm",
    "transport": "transport.agent-local",
    "verifier": "verifier.tls-remote",
    "rollback": "rollback.windows-iis"
  },
  "automation": "full",
  "rollbackRequired": true,
  "verificationRequired": true,
  "limitations": [
    "仅支持 Windows Server 2008 R2 SP1 至 Windows Server 2012 R2 的独立兼容产品线",
    "Windows Server 2008 R2 SP1 + IIS 7.5 真实认证完成前不得提升为 certified",
    "必须通过前置检查声明的 .NET Framework 4.8、TLS 1.2、补丁、权限、证书存储和控制面连通性检查"
  ],
  "evidence": [
    {
      "evidenceId": "windows-compatibility-agent.contract-build",
      "type": "contract_test",
      "status": "passed",
      "reference": "agents/windows-compat-full-agent/tests/Program.cs",
      "observedAt": "2026-07-21T00:00:00.000Z",
      "expiresAt": "2026-08-21T00:00:00.000Z"
    }
  ],
  "publishedAt": "2026-07-21T00:00:00.000Z"
}
